rating,text,reviewer,variant,date,original_text
1,pengiriman sangat lama walaupun diluar pihak penjual tetapi ini mempengaruhi pelayanan terjadap konsumen sehingga saya merasa kurang puas belanja disini meskipun barang bagus,iqwan,Space Grey,9 bulan lalu,"Pengiriman sangat lama. Walaupun diluar pihak penjual, tetapi ini mempengaruhi pelayanan terjadap konsumen, sehingga saya merasa kurang puas belanja disini. Meskipun barang bagus."
1,segini banget packingannya untung isinya aman gak tercecer di jalan ngerii ngeri pake kurir rekomendasi dari awal juga nda ada pilihan packing kayunya semoga matepadnya gak ada masalah nanti,A l,Grey Proteksi,Lebih dari 1 tahun lalu,"segini banget packingannya,untung isinya aman gak tercecer di jalan..ngerii ngeri pake kurir rekomendasi. dari awal juga nda ada pilihan packing kayunya. semoga matepadnya gak ada masalah nanti"
1,keyboard mati masa cuman gara2 barang harus po dlu terus barang gak di cek kualitas sih sudah ke service center jga tetap mati di janjikan ganti unit tapi gak tau sampai kapan tidak ada kpastian kalo lama dan gak dapet apa dari kesalahan hwaweinya fix kapok sih beli lagi productnya review bisa di ganti bintang bisa bertambah tapi masa cuman dapat kata maaf,c i,Grey Proteksi,Lebih dari 1 tahun lalu,"keyboard mati, masa cuman gara2 barang harus PO dlu terus barang gak di cek kualitas sih? sudah ke service center jga tetap mati, di janjikan ganti unit tapi gak tau sampai kapan, tidak ada kpastian. kalo lama dan gak dapet apa dari kesalahan hwaweinya, fix kapok sih beli lagi productnya review bisa di ganti bintang bisa bertambah, tapi masa cuman dapat kata maaf"
1,huawei it self a good brand and quality unfortunately the person behind huawei online via tokopedia is able to change the specification bonus without prior notice first of all we put product in basket at that time still with bonus pencil then time to buy coming and surprisingly the pen is gone without prior notice so we receive only product without pencil so the way admin can change the bonus spec so sudenly and without thinking impact to the brand i m very disapointed hopefully huawei international can read this and giving a proper training to your sales online team they are being paid by you but they are careless,Johanes,Violet EWS,11 bulan lalu,"HUAWEI it self a good brand and quality, unfortunately the person behind huawei online via tokopedia, is able to change the specification bonus without prior notice. First of all, we put product in basket, at that time still with bonus pencil, then time to buy coming and surprisingly, the pen is gone, without prior notice. So we receive only product without pencil. So, the way admin can change the bonus spec so sudenly, and without thinking impact to the Brand. I'm very disapointed. Hopefully Huawei International can read this, and giving a proper training to your sales online team. They are being paid by you but they are careless."
1,ga kepake ngga compatible dgn banyak platform mau google meet aja gabisa semua harus download apps non official jd trust issues dgn keamanan pdhal build produknya bagus banget dari beli sd skrg ga pernah bener2 dipake kasih ke anak buat nonton yt atau main roblox aja banyak glitchnya gara2 cuma bisa pake browser atau apk ga resmi oya kualitas browser bawaaannya ampuuuuun parah banget,J h,Grey Proteksi,9 bulan lalu,"Ga kepake, ngga compatible dgn banyak platform, mau google meet aja gabisa. Semua harus download apps non official jd trust issues dgn keamanan. Pdhal build produknya bagus banget. Dari beli sd skrg ga pernah bener2 dipake...  kasih ke anak buat nonton YT atau main Roblox aja banyak glitchnya gara2 cuma bisa pake browser atau apk ga resmi. Oya... kualitas browser bawaaannya.... Ampuuuuun parah banget!"
1,pengiriman lama pelayanan cs kaya packing nya hancur untung barang aman saya harus mencari barang nya di bbrp counter di jakarta dan semarang karena barang sudah hilang entah kemana selama bulan lebih dan cs hanya bisa maaf mohon sabar menunggu sabar menunggu sudah bulan sampai harus cari bbrp counter di jakarta dan semarang,d g,Spcae Grey EWS,11 bulan lalu,"pengiriman lama... pelayanan cs kaya ****** packing nya hancur, untung barang aman... saya harus mencari barang nya di bbrp counter di jakarta dan semarang karena barang sudah hilang entah kemana selama 1 bulan lebih. dan cs hanya bisa maaf mohon sabar menunggu. sabar menunggu sudah 1 bulan sampai harus cari bbrp counter di jakarta dan semarang."
1,gak dapat m pencil dalih promo berubah ubah,Kurniawan,Space Grey,8 bulan lalu,"Gak dapat m pencil, dalih promo berubah-ubah"
3,pengemasan mengecewakan dengan kemasan yg didalamnya berisi barang yang mudah rentan rusak dan bernilai jta pengemasan seolah olah asal asalan gag tau dilayan jasa kirimnya yg kurang hati hati dan juga memang kardus luarnya kurang safety dan kardus hp dalamnya juga penyok mohon diperhatikan lagi dalam pengemasannya karena yg dikirim bukan,E o,Grey Proteksi,Lebih dari 1 tahun lalu,"pengemasan mengecewakan. dengan kemasan yg didalamnya berisi barang yang mudah rentan rusak dan bernilai 8 jta, pengemasan seolah olah asal asalan. gag tau dilayan jasa kirimnya yg kurang hati hati dan juga memang kardus luarnya kurang safety. dan kardus hp dalamnya juga penyok.mohon diperhatikan lagi dalam pengemasannya karena yg dikirim bukan"
3,barang masih segel produk ori cuman kemasannya apakah itu packingan dari huawei atau di bongkar sama ekspedisi packingnya penyok rusak dan ada indikasi dibongkar dan dilakban ulang tidak ada plastik yang melindungi barang,Aditiawarman,Violet EWS,9 bulan lalu,"barang masih segel, produk ori. cuman kemasannya apakah itu packingan dari huawei, atau di bongkar sama ekspedisi, packingnya penyok, rusak dan ada indikasi dibongkar dan dilakban ulang. tidak ada plastik yang melindungi barang."
3,ada baik nya huawei official store perbaiki cara paking yg baik pake fragile stiker dan customer milih pengiriman reguler pake pesawat bukan dipindah kan ke trucking jg lama dan merusak paket nya terimakasih,Bharata,Space Grey,11 bulan lalu,Ada Baik nya Huawei official Store perbaiki cara paking yg Baik pake fragile stiker dan customer milih pengiriman reguler pake pesawat bukan dipindah kan ke trucking jg lama dan merusak paket nya. Terimakasih
3,packing masih kurang untuk barang yang harganya lumayan mahal kualitas produk mantap jauh lebih baik daripada ipad pro keluaran dan ke bawah kualitas gambar jernih warna teramat sangat akurat dan speaker mantaps ada wps office pc level yang eksklusif hanya ada di huawei dan gopaint yang sudah dengan procreate sangat recommended untuk dijadikan tablet daily driver untuk pelajar maupun pekerja,Kevin,Space Grey,9 bulan lalu,"Packing masih kurang untuk barang yang harganya lumayan mahal. Kualitas produk mantap. Jauh lebih baik daripada iPad pro keluaran 2023 dan ke bawah. Kualitas gambar jernih, warna teramat sangat akurat, dan speaker mantaps. Ada WPS Office PC Level yang eksklusif hanya ada di Huawei dan GoPaint yang sudah 11/12 dengan ProCreate. Sangat recommended untuk dijadikan tablet daily driver untuk pelajar maupun pekerja."
3,biar toko dan tokopedia tau gini loh kualitas jasa bag pengiriman barang ongkir dibayar loh bukan gratis kasihan toko nya jika mesti retur dll urus komplain bs bulan ini selisih dikit lagi kena tab nya pdhl packing udah pakai bubble loh bayangin brp parah jasa perpindahan barang,Ratno,Grey Proteksi,12 bulan lalu,Biar toko dan tokopedia tau. Gini loh kualitas jasa bag pengiriman barang. (ongkir dibayar loh bukan gratis). Kasihan toko nya jika mesti retur dll. Urus komplain bs 1 bulan. Ini selisih dikit lagi kena tab nya. Pdhl packing udah pakai bubble loh. Bayangin brp parah jasa perpindahan barang.
3,pengemasan wajib lebih safety lagi sekelas huawei official store packing barang harga 8juta udah seperti packing barang harga 50ribu sangat rentan saat pengiriman dus luar penyok dus dalam juga penyok,Heri,Space Grey,Lebih dari 1 tahun lalu,"Pengemasan Wajib lebih Safety lagi, Sekelas HUAWEI Official Store, packing barang harga 8juta udah seperti packing barang harga 50ribu, Sangat rentan saat pengiriman, dus luar penyok dus dalam juga penyok."
3,kurir rekomendasi tapi tdk di rekomendasikan kecewa dgn kurir dan penjualnya beli barang di hari dan waktu yg hampir sama tp pake kurir beda barang yg di bawah kurir jg penyok seperti gambar,a l,Grey Proteksi,12 bulan lalu,"kurir rekomendasi tapi tdk di rekomendasikan. kecewa dgn kurir dan penjualnya. beli 2 barang di hari dan waktu yg hampir sama, tp pake 2 kurir beda. barang yg di bawah kurir jg penyok seperti gambar"
3,barang hilang dihilangin kurir hindari penggunaan sicepat kualitas minus maaf gak bintang karena toko juga kurang baik dalam menangani komplain customer selain itu dana refund ditahan oleh pihak tokopedia tanpa ada kejelasan tanggal penyelesaian proses di aplikasi tanggal juli kemudian dijanjikan cair tanggal agustus tapi sampai dengan saat ini belum juga ada cair itu uang saya gak terima barang duit juga ditahan tokopedia,F r,Grey Proteksi,11 bulan lalu,"Barang hilang, dihilangin kurir, hindari penggunaan SiCepat, kualitas minus, maaf gak 5 bintang karena toko juga kurang baik dalam menangani komplain customer. Selain itu, dana refund ditahan oleh pihak Tokopedia tanpa ada kejelasan, tanggal penyelesaian proses di aplikasi tanggal 30 Juli, kemudian dijanjikan cair tanggal 1 Agustus, tapi sampai dengan saat ini belum juga ada cair itu uang saya. Gak terima barang, duit juga ditahan Tokopedia."
3,packagingnya parah amat dri pihak kurir klaim kalo packagingnya udh terbuka untungnya udh di klarifikasi lewat video sm kurirnya klo barangnya aman dan lengkap tolong diperbaiki lagi packagingnya kalo dikirim ke luar pulau bahaya bisa hilang atau rusak,G y,Spcae Grey EWS,Lebih dari 1 tahun lalu,"packagingnya parah amat, dri pihak kurir klaim kalo packagingnya udh terbuka untungnya udh di klarifikasi lewat video sm kurirnya klo barangnya aman dan lengkap tolong diperbaiki lagi packagingnya kalo dikirim ke luar pulau bahaya bisa hilang atau rusak"
3,plus gambar tajem build quality sesuai harganya bagus bonus pencil detachable keyboard packing lumayan aman cocok bagi designer yg suka gambar tablet versi papermatte nyaman minus device huawei matepad menerapkan system spoofing device matepad akan terdeteksi oleh google menjadi oppo lain ketika login dengan akun google kalian banyak bug di apps system karena ini bukan android service pake huawei punya jadi gak disarankan bagi yg newbie di tech karena butuh waktu buat penyesuaian akses ke aplikasi terbatas karena gak terhubung langsung dengan playstore update os yg terbatas butuh effort buat setting karena system yy beda dari android apps nya yg sering ngebug minim resource official buat research semisal ada bugs jadi harus ke cs huawei jujur ada sedikit rasa kecewa karena ngira bakal dynamis dan bagus system dari huawei tapi ngerasa kaya jadi user beta devicenya its ok experience tablet nya buat kerja lumayan ngebantu juga,Anggara,Space Grey,9 bulan lalu,"Plus - gambar tajem - build quality sesuai harganya, bagus - bonus pencil & detachable keyboard - packing lumayan aman - cocok bagi designer, yg suka gambar , tablet versi papermatte nyaman Minus - device huawei matepad menerapkan system spoofing, device matepad akan terdeteksi oleh google menjadi oppo & lain"" ketika login dengan akun google kalian - banyak bug di apps & system Karena ini bukan android, & service pake huawei punya. Jadi gak disarankan bagi yg newbie di tech, karena butuh waktu buat penyesuaian - akses ke aplikasi terbatas, karena gak terhubung langsung dengan playstore - update os yg terbatas - butuh effort buat setting, karena system yy beda dari android & apps nya yg sering ngebug - minim resource official buat research semisal ada bugs, jadi harus ke cs huawei Jujur ada sedikit rasa kecewa, karena ngira bakal dynamis dan bagus system dari huawei. Tapi ngerasa kaya jadi user beta devicenya. Its ok, experience tablet nya buat kerja lumayan ngebantu juga."
4,barang masih segel tetapi kotak pengiriman penyok parah sehingga kena kotak barang jd ikut penyok semoga isinya aman,Budhi,Spcae Grey EWS,Lebih dari 1 tahun lalu,"Barang masih segel, tetapi kotak pengiriman penyok parah sehingga kena kotak barang jd ikut penyok. Semoga isinya aman"
4,pengiriman lama kerdusnya ga berbentuk tapi aman barang oke original asli no kw kw,f h,Violet,12 bulan lalu,pengiriman lama kerdusnya ga berbentuk tapi aman barang oke original asli no kw kw
4,kondisi barang saat sampai sangat lengkap baik dan aman cuman waktu po nya aja agak lama tapi syukurnya saya pilih pengiriman yg tepat barang sampai dengan cepat akhirnya terima kasih huawei,Bung,Spcae Grey EWS,Lebih dari 1 tahun lalu,"kondisi barang saat sampai sangat lengkap, baik, dan aman. cuman waktu PO nya aja agak lama, tapi syukurnya saya pilih pengiriman yg tepat, barang sampai dengan cepat akhirnya. terima kasih huawei"
4,barang bagus packaging jelek dus barang didalamnya sdkt penyok untungnya dus bawaan huawei tebal mohon utk penjual memperhatikan nya apalagi ini toko official,R d,Grey Proteksi,Lebih dari 1 tahun lalu,"Barang bagus, packaging jelek. Dus barang didalamnya sdkt penyok, untungnya dus bawaan huawei tebal. Mohon utk penjual memperhatikan nya apalagi ini toko official"
4,produk gaada masalah bagus cuma ngacoo banget packingnya cok kardus tipis jeleeek gak niat packing packing harga jutaan kalah sm barang 200rb an,i n,Spcae Grey EWS,Lebih dari 1 tahun lalu,"Produk gaada masalah, bagus.. Cuma ngacoo banget packingnya cok, kardus tipis, jeleeek, gak niat packing Packing harga jutaan kalah sm barang 200rb an"
5,barang sesuai pesanan dapat bonus mpencil dan keyboard sesuai di foto pengiriman cepat berfungsi dengan baik desain keren dan fitur sangat keren tab terbaik dengan harga yg oke dapat diskon lumayan waktu mantap,Dimas,Violet,9 bulan lalu,"Barang sesuai pesanan, dapat bonus Mpencil dan keyboard sesuai di foto, pengiriman cepat, berfungsi dengan baik, desain keren dan fitur sangat keren, tab terbaik dengan harga yg oke. dapat diskon lumayan waktu 10.10, mantap"
5,barang original berfungsi baik lengkap pengiriman sesuai mate tidak ada pantulan cahaya namun paperlike feelnya agak kurang terasa,H y,Space Grey,9 bulan lalu,"barang original, berfungsi baik, lengkap, pengiriman sesuai. mate tidak ada pantulan cahaya, namun paperlike feelnya agak kurang terasa"
5,barang aman sampai tujuan masih segel dan dpt keyboard sayang ga dapat mouse dan pen,D s,Violet,4 bulan lalu,barang aman sampai tujuan. masih segel dan dpt keyboard. sayang ga dapat mouse dan pen
5,barang bagus dan tersegel fast respon tapi mengapa tak de pensil bonusnya ya mana di storenya kosong,T I,Spcae Grey EWS,7 bulan lalu,"Barang bagus dan tersegel, fast respon, tapi mengapa tak de pensil bonusnya ya. Mana di storenya kosong."
5,produk original dan semua berfungsi dengan baik po tidak sampai hari sudah terkirim mantap,Aldi,Grey Proteksi,Lebih dari 1 tahun lalu,produk original dan semua berfungsi dengan baik. PO tidak sampai 11 hari sudah terkirim. mantap
